<?xml version="1.0"?>
<!DOCTYPE cib SYSTEM "crm-1.0.dtd">
<cib num_updates="1" epoch="1" admin_epoch="0">
  <configuration>
    <crm_config><cluster_property_set id="cib-bootstrap-options"><attributes>
      <nvpair id="symmetric_cluster" name="symetric_cluster" value="true"/>
      <nvpair id="no_quorum_policy" name="no_quorum_policy" value="ignore"/>
    </attributes></cluster_property_set></crm_config>
    <nodes>
      <node id="uuid1" uname="node1" type="member">
        <instance_attributes id="any">
          <attributes>
            <nvpair id="server_group" name="server_group" value="group1"/>
          </attributes>
        </instance_attributes>
      </node>
      <node id="uuid2" uname="node2" type="member">
        <instance_attributes id="any">
	  <rule id="1">
	    <date_expression id="1" end="2005-001"/>
	  </rule>
          <attributes>
            <nvpair id="server_group" name="server_group" value="group2"/>
          </attributes>
        </instance_attributes>
        <instance_attributes id="any">
	  <rule id="2">
	    <date_expression id="2" start="2005-001" operation="gt"/>
	  </rule>
          <attributes>
            <nvpair id="server_group" name="server_group" value="group3"/>
          </attributes>
        </instance_attributes>
      </node>
    </nodes>
    <resources>
      <primitive id="rsc1" class="heartbeat" type="apache">
        <instance_attributes id="any">
	  <rule id="3">
            <expression id="1" attribute="#uname" operation="eq" value="node1"/>
	  </rule>
          <attributes>
            <nvpair id="1" name="interface" value="eth1"/>
          </attributes>
        </instance_attributes>
        <instance_attributes id="any">
	  <rule id="4">
            <expression id="1" attribute="#uname" operation="eq" value="node2"/>
	  </rule>
          <attributes>
            <nvpair id="1" name="interface" value="eth2"/>
          </attributes>
        </instance_attributes>
      </primitive>
    </resources>
    <constraints>
      <rsc_location id="run_rsc1" rsc="rsc1">
	<rule id="prefer_group3" score="100">
	  <expression  id="any" attribute="server_group" operation="eq" value="group3"/>
	</rule>
      </rsc_location>
    </constraints>
  </configuration>
  <status>
    <node_state id="uuid1" ha="active" uname="node1" crmd="online" join="member" expected="member" in_ccm="true"/>
    <node_state id="uuid2" ha="active" uname="node2" crmd="online" join="member" expected="member" in_ccm="true"/>
  </status>
</cib>
