<?xml version="1.0"?>
<!DOCTYPE cib SYSTEM "crm-1.0.dtd">
<cib>
  <configuration>
    <crm_config>
      <nvpair id="symmetric_cluster" name="symetric_cluster" value="false"/>
      <nvpair id="no_quorum_policy" name="no_quorum_policy" value="ignore"/>
    </crm_config>
    <nodes>
      <node id="uuid1" uname="node1" type="member"/>
      <node id="uuid2" uname="node2" type="member"/>
    </nodes>
    <resources>
      <native id="rsc1" class="heartbeat" type="apache"/>
    </resources>
    <constraints>
      <rsc_location id="run_rsc1" rsc="rsc1">
	<rule id="can1" score="1">
	  <expression attribute="#id" operation="lt" value="uuid3"/>
	  <expression attribute="#uname" operation="gt" value="node1"/>
	</rule>
      </rsc_location>
    </constraints>
  </configuration>
  <status>
    <node_state id="uuid1" uname="node1" crmd="online" join="member" expected="member" timestamp="1086187789" in_ccm="true"/>
    <node_state id="uuid2" uname="node2" crmd="online" join="member" expected="member" timestamp="1086187789" in_ccm="true"/>
  </status>
</cib>
