<?xml version="1.0"?>
<!DOCTYPE cib SYSTEM "crm-1.0.dtd">
<!-- shutdown -->
<cib num_updates="1" epoch="1" admin_epoch="0">
  <configuration>
    <crm_config><cluster_property_set id="cib-bootstrap-options"><attributes>
      <nvpair id="no_quorum_policy" name="no_quorum_policy" value="ignore"/>
      <nvpair id="symmetric_cluster" name="symmetric_cluster" value="true"/>
      <nvpair id="default_resource_stickiness" name="default_resource_stickiness" value="100"/>
    </attributes></cluster_property_set></crm_config>
    <nodes>
      <node id="node1" uname="node1" type="member"/>
      <node id="node2" uname="node2" type="member"/>
    </nodes>
    <resources>
      <primitive id="rsc3" class="heartbeat" type="apache" />
      <primitive id="rsc4" class="heartbeat" type="apache" />
      <group id="foo">
	<primitive id="rsc1" class="heartbeat" type="apache"/>
      </group>
      <group id="bar">
	<primitive id="rsc2" class="heartbeat" type="apache" />
      </group>
    </resources>
    <constraints>
    </constraints>
  </configuration>
  <status>
    <node_state id="node1" ha="active" uname="node1" crmd="online" join="member" expected="member" in_ccm="true">
      <lrm id="node1">
        <lrm_resources>
          <lrm_resource id="foo:rsc1" class="heartbeat" type="apache">
            <lrm_rsc_op id="foo:rsc1_start_0" operation="start" interval="0" op_status="0" rc_code="0" call_id="1" op_digest="f2317cad3d54cec5d7d7aa7d0bf35cf8" crm_feature_set="1.0.6" transition_magic=""/>
          </lrm_resource>
          <lrm_resource id="rsc3" class="heartbeat" type="apache">
            <lrm_rsc_op id="rsc3_start_0" operation="start" interval="0" op_status="0" rc_code="0" call_id="1" op_digest="f2317cad3d54cec5d7d7aa7d0bf35cf8" crm_feature_set="1.0.6" transition_magic=""/>
          </lrm_resource>
          <lrm_resource id="bar:rsc2" class="heartbeat" type="apache">
            <lrm_rsc_op id="bar:rsc2_start_0" operation="start" interval="0" op_status="0" rc_code="0" call_id="1" op_digest="f2317cad3d54cec5d7d7aa7d0bf35cf8" crm_feature_set="1.0.6" transition_magic=""/>
          </lrm_resource>
          <lrm_resource id="rsc4" class="heartbeat" type="apache">
            <lrm_rsc_op id="rsc4_start_0" operation="start" interval="0" op_status="0" rc_code="0" call_id="1" op_digest="f2317cad3d54cec5d7d7aa7d0bf35cf8" crm_feature_set="1.0.6" transition_magic=""/>
          </lrm_resource>
        </lrm_resources>
      </lrm>
    </node_state>
    <node_state id="node2" ha="active" uname="node2" crmd="online" join="member" expected="member" in_ccm="true">
    </node_state>
  </status>
</cib>
