<?xml version="1.0"?>
<!DOCTYPE cib SYSTEM "crm-1.0.dtd">
<cib>
  <configuration>
    <crm_config><cluster_property_set id="cib-bootstrap-options"><attributes>
      <nvpair id="stonith_enabled" name="stonith_enabled" value="false"/>
      <nvpair id="no_quorum_policy" name="no_quorum_policy" value="ignore"/>
    </attributes></cluster_property_set></crm_config>
    <nodes>
      <node id="uuid1" uname="node1" type="member"/>
      <node id="uuid2" uname="node2" type="member"/>
    </nodes>
    <resources>
      <primitive id="rsc1" class="heartbeat" type="apache" on_stopfail="block"/>
      <primitive id="rsc2" class="heartbeat" type="apache" on_stopfail="block"/>
    </resources>
    <constraints/>
  </configuration>
  <status>
    <node_state id="uuid2" uname="node2" crmd="online" join="member" expected="member" timestamp="1086187789" in_ccm="true"/>
  </status>
</cib>
