<?xml version="1.0"?>
<!DOCTYPE cib SYSTEM "crm-1.0.dtd">
<!-- shutdown -->
<cib num_updates="1" epoch="1" admin_epoch="0">
  <configuration>
    <crm_config><cluster_property_set id="cib-bootstrap-options"><attributes>
      <nvpair id="no_quorum_policy" name="no_quorum_policy" value="ignore"/>
      <nvpair id="symmetric_cluster" name="symmetric_cluster" value="false"/>
    </attributes></cluster_property_set></crm_config>
    <nodes>
      <node id="node1" uname="node1" type="member"/>
      <node id="node2" uname="node2" type="member"/>
      <node id="node3" uname="node3" type="member"/>
    </nodes>
    <resources>
      <primitive id="rsc1" class="lsb" type="apache"/>
      <primitive id="rsc2" class="lsb" type="apache"/>
      <primitive id="rsc3" class="lsb" type="apache"/>
    </resources>
    <constraints>
      <rsc_location id="cons1" rsc="rsc1">
	<rule id="score1" score="10">
	  <expression id="exp1" attribute="#uname" operation="eq" value="node1"/>
	</rule>
      </rsc_location>	
      <rsc_location id="cons2" rsc="rsc2">
	<rule id="score2" score="20">
	  <expression id="exp2" attribute="#uname" operation="eq" value="node2"/>
	</rule>
      </rsc_location>	
      <rsc_location id="cons3" rsc="rsc3">
	<rule id="score3" score="30">
	  <expression id="exp3" attribute="#uname" operation="eq" value="node3"/>
	</rule>
      </rsc_location>	
    </constraints>
  </configuration>
  <status>
    <node_state id="node1" ha="active" uname="node1" crmd="online" join="member" expected="member" in_ccm="true" shutdown="1086187789">
      <lrm id="1" >
        <lrm_resources>
          <lrm_resource id="rsc1" class="heartbeat" type="apache">
            <lrm_rsc_op id="rsc1_start_0" op_digest="f2317cad3d54cec5d7d7aa7d0bf35cf8" operation="start" interval="0" op_status="0" rc_code="0" call_id="1" crm_feature_set="1.0.6" transition_magic=""/>
          </lrm_resource>
        </lrm_resources>
      </lrm>
       <transient_attributes id="3d8227f0-31dd-4801-b0db-987909d4a321">
         <instance_attributes id="status-3d8227f0-31dd-4801-b0db-987909d4a321">
           <attributes>
	     <nvpair id="shutdown-1" name="shutdown" value="1234"/>
           </attributes>
         </instance_attributes>
       </transient_attributes>
    </node_state>
    <node_state id="node2" ha="active" uname="node2" crmd="online" join="member" expected="member" in_ccm="true">
      <lrm id="2" >
        <lrm_resources>
          <lrm_resource id="rsc2" class="heartbeat" type="apache">
            <lrm_rsc_op id="rsc2_start_0" op_digest="f2317cad3d54cec5d7d7aa7d0bf35cf9" operation="start" interval="0" op_status="0" rc_code="0" call_id="1" crm_feature_set="1.0.6" transition_magic=""/>
          </lrm_resource>
        </lrm_resources>
      </lrm>
    </node_state>
    <node_state id="node3" ha="active" uname="node3" crmd="online" join="member" expected="member" in_ccm="true">
      <lrm id="3" >
        <lrm_resources>
          <lrm_resource id="rsc3" class="ocf" type="apache">
            <lrm_rsc_op id="rsc3_stop_0" operation="stop" interval="0" op_status="0" rc_code="0" call_id="2" crm_feature_set="1.0.6" transition_magic=""/>
          </lrm_resource>
        </lrm_resources>
      </lrm>
    </node_state>
  </status>
</cib>
