<?xml version="1.0"?>
<!DOCTYPE cib SYSTEM "crm-1.0.dtd">
<cib>
  <configuration>
    <crm_config><cluster_property_set id="cib-bootstrap-options"><attributes>
      <nvpair id="no_quorum_policy" name="no_quorum_policy" value="ignore"/>
    </attributes></cluster_property_set></crm_config>
    <nodes>
      <node id="uuid1" uname="node1" type="member"/>
      <node id="uuid2" uname="node2" type="member"/>
      <node id="uuid3" uname="node3" type="member"/>
    </nodes>
    <resources>
      <primitive id="rsc0" class="heartbeat" type="apache"/>
      <clone id="rsc1" interleave="1">
        <instance_attributes>
          <attributes>
            <nvpair name="clone_max" value="5"/>
            <nvpair name="clone_node_max" value="2"/>
          </attributes>
        </instance_attributes>
	<primitive id="child_rsc1" class="heartbeat" type="apache"/>
      </clone>
      <clone id="rsc2" interleave="1">
        <instance_attributes>
          <attributes>
            <nvpair name="clone_max" value="5"/>
            <nvpair name="clone_node_max" value="2"/>
          </attributes>
        </instance_attributes>
	<primitive id="child_rsc2" class="heartbeat" type="apache"/>
      </clone>
    </resources>
    <constraints>
      <rsc_order id="order1" from="rsc1" type="before" to="rsc2"/>
      <rsc_colocation id="order1" from="rsc1" to="rsc2" score="INFINITY"/>
    </constraints>
  </configuration>
  <status>
    <node_state id="uuid1" uname="node1" crmd="online" join="member" expected="member" timestamp="1086187789" in_ccm="true">
      <transient_attributes>
        <instance_attributes>
	  <attributes>
	    <nvpair id="probed" name="probe_complete" value="true"/>
	  </attributes>
        </instance_attributes>
      </transient_attributes>
    </node_state>
    <node_state id="uuid2" uname="node2" crmd="online" join="member" expected="member" timestamp="1086187789" in_ccm="true">
      <transient_attributes>
        <instance_attributes>
	  <attributes>
	    <nvpair id="probed" name="probe_complete" value="true"/>
	  </attributes>
        </instance_attributes>
      </transient_attributes>
    </node_state>
    <node_state id="uuid3" uname="node3" crmd="online" join="member" expected="member" timestamp="1086187789" in_ccm="true">
      <transient_attributes>
        <instance_attributes>
	  <attributes>
	    <nvpair id="probed" name="probe_complete" value="true"/>
	  </attributes>
        </instance_attributes>
      </transient_attributes>
    </node_state>
  </status>
</cib>
