<?xml version="1.0"?>
<!DOCTYPE cib SYSTEM "crm-1.0.dtd">
<!-- must not -->
<cib>
  <configuration>
    <crm_config><cluster_property_set id="cib-bootstrap-options"><attributes>
      <nvpair id="no_quorum_policy" name="no_quorum_policy" value="ignore"/>
    </attributes></cluster_property_set></crm_config>
    <nodes>
      <node id="node1" uname="node1" type="member"/>
      <node id="node2" uname="node2" type="member"/>
    </nodes>
    <resources>
      <primitive id="rsc1" class="heartbeat" type="apache">
        <instance_attributes>
          <attributes>
            <nvpair name="priority" value="1.0"/>
          </attributes>
        </instance_attributes>
      </primitive>
      <primitive id="rsc2" class="heartbeat" type="apache">
        <instance_attributes>
          <attributes>
            <nvpair name="priority" value="2.0"/>
          </attributes>
        </instance_attributes>
      </primitive>
    </resources>
    <constraints>
      <rsc_colocation id="not_same_1" from="rsc1" to="rsc2" score="-INFINITY"/>
      <rsc_location id="run_rsc2" rsc="rsc2">
	<rule id="score1" score="10">
	  <expression id="exp1" attribute="rsc1" operation="#colocated"/>
	</rule>
      </rsc_location>
    </constraints>
  </configuration>
  <status>
    <node_state id="node1" uname="node1" crmd="online" join="member" expected="member" timestamp="1086187789" in_ccm="true">
      <lrm>
	<lrm_agents>
	  <lrm_agent class="heartbeat" type="apache"/>
	</lrm_agents>
        <lrm_resources/>
      </lrm>
    </node_state>
    <node_state id="node2" uname="node2" crmd="online" join="member" expected="member" timestamp="1086187789" in_ccm="true">
      <lrm>
	<lrm_agents>
	  <lrm_agent class="heartbeat" type="apache"/>
	</lrm_agents>
        <lrm_resources>
          <lrm_resource id="rsc1" last_op="start" rsc_state="started" op_status="0" rc_code="0">
            <lrm_rsc_op id="rsc1" operation="start" rsc_state="started" op_status="0" rc_code="0" call_id="1"/>
	  </lrm_resource>
        </lrm_resources>
      </lrm>
    </node_state>
  </status>
</cib>
