<?xml version="1.0"?>
<!DOCTYPE cib SYSTEM "crm-1.0.dtd">
<cib num_updates="1" epoch="1" admin_epoch="0" ingore-dtd="none">
  <configuration>
    <crm_config><cluster_property_set id="cib-bootstrap-options"><attributes>
      <nvpair id="no_quorum_policy" name="no_quorum_policy" value="ignore"/>
      <nvpair id="symmetric_cluster" name="symmetric_cluster" value="true"/>
    </attributes></cluster_property_set></crm_config>
    <nodes>
      <node id="node1" uname="node1" type="member"/>
    </nodes>
    <resources>
      <primitive id="rsc1" class="heartbeat" type="apache"/>
    </resources>
    <constraints>
    </constraints>
  </configuration>
  <status>
    <node_state id="node1" ha="active" uname="node1" crmd="offline" join="down" expected="down" in_ccm="true"/>
  </status>
</cib>
