<?xml version="1.0"?>
<!DOCTYPE cib SYSTEM "crm-1.0.dtd">
<cib>
 <configuration>
  <nodes>
    <node id="node1" uname="node1" type="member"/>
  </nodes>
  <resources>
     <resource id="rsc1" class="heartbeat" type="apache" priority="1.0" version="2.0"/>
  </resources>
  <constraints>
      <rsc_location id="run_rsc1" rsc="rsc1">
	<rule id="can1" result="can"/>
      </rsc_location>
  </constraints>
 </configuration>
 <status>
    <node_state id="node1" crmd="online" join="member" expected="member" timestamp="1086187789" in_ccm="true">
      <lrm>
	<lrm_agents>
	  <lrm_agent class="heartbeat" type="apache" version="1.0"/>
	</lrm_agents>
        <lrm_resources/>
      </lrm>
    </node_state>
 </status>
</cib>
