<?xml version="1.0"?>
<!DOCTYPE cib SYSTEM "crm-1.0.dtd">
<cib>
  <configuration>
    <crm_config><cluster_property_set id="cib-bootstrap-options"><attributes>
      <nvpair id="no_quorum_policy" name="no_quorum_policy" value="ignore"/>
      <nvpair id="symmetric_cluster" name="symmetric_cluster" value="true"/>
    </attributes></cluster_property_set></crm_config>
    <nodes>
      <node id="uuid1" uname="node1" type="member"/>
      <node id="uuid2" uname="node2" type="member"/>
    </nodes>
    <resources>
      <primitive id="rsc1" class="heartbeat" type="apache"/>
    </resources>
    <constraints/>
  </configuration>
  <status>
    <node_state id="uuid1" uname="node1" crmd="online" join="member" expected="member" timestamp="1086187789" in_ccm="true">
      <lrm>
        <lrm_resources>
          <lrm_resource id="rsc1" class="heartbeat" type="apache">
            <lrm_rsc_op id="rsc1_start_0" operation="start" interval="0" rsc_state="start_failed" op_status="4" rc_code="152" call_id="1" op_digest="f2317cad3d54cec5d7d7aa7d0bf35cf8"/>
	  </lrm_resource>
        </lrm_resources>
      </lrm>
    </node_state>
    <node_state id="uuid2" uname="node2" crmd="online" join="member" expected="member" timestamp="1086187789" in_ccm="true">
      <lrm>
        <lrm_resources>
          <lrm_resource id="rsc1" class="heartbeat" type="apache">
            <lrm_rsc_op id="rsc1_start_0" operation="start" interval="0" rsc_state="start_failed" op_status="4" rc_code="152" call_id="1" op_digest="f2317cad3d54cec5d7d7aa7d0bf35cf8"/>
	  </lrm_resource>
        </lrm_resources>
      </lrm>
    </node_state>
  </status>
</cib>
