<?xml version="1.0"?>
<!DOCTYPE cib SYSTEM "crm-1.0.dtd">
<!-- must not -->
<cib num_updates="1" epoch="1" admin_epoch="0">
  <configuration>
    <crm_config><cluster_property_set id="cib-bootstrap-options"><attributes>
      <nvpair id="no_quorum_policy" name="no_quorum_policy" value="ignore"/>
    </attributes></cluster_property_set></crm_config>
    <nodes>
      <node id="node1" uname="node1" type="member"/>
      <node id="node2" uname="node2" type="member"/>
    </nodes>
    <resources>
      <primitive id="rsc1" class="heartbeat" type="apache"/>
    </resources>
    <constraints>
      <rsc_location id="run_rsc1" rsc="rsc1">
	<rule id="score1" score="1000">
	  <expression id="exp1" attribute="rsc1" operation="#not_colocated"/>
	</rule>
      </rsc_location>
    </constraints>
  </configuration>
  <status>
    <node_state id="node1" ha="active" uname="node1" crmd="online" join="member" expected="member" in_ccm="true">
      <lrm id="any">
        <lrm_resources>
          <lrm_resource id="rsc1" last_op="start" op_status="0" rc_code="0">
            <lrm_rsc_op id="rsc1_start_0" operation="start" interval="0" op_status="0" rc_code="0" call_id="1" crm_feature_set="1.0.6" transition_magic=""/>
	  </lrm_resource>
        </lrm_resources>
      </lrm>
    </node_state>
    <node_state id="node2" ha="active" uname="node2" crmd="online" join="member" expected="member" in_ccm="true"/>
  </status>
</cib>
