<?xml version="1.0"?>
<!DOCTYPE cib SYSTEM "crm-1.0.dtd">
<cib>
  <configuration>
    <crm_config>
      <nvpair id="no_quorum_policy" name="no_quorum_policy" value="ignore"/>
      <nvpair id="symmetric_cluster" name="symmetric_cluster" value="true"/>
    </crm_config>
    <nodes>
      <node id="node1" uname="node1" type="member"/>
    </nodes>
    <resources>
      <primitive id="rsc1" class="heartbeat" type="apache" priority="1.0"/>
    </resources>
    <constraints>
    </constraints>
  </configuration>
  <status>
    <node_state id="node1" crmd="offline" join="down" expected="down" timestamp="1086187789" in_ccm="true"/>
  </status>
</cib>
