<?xml version="1.0"?>
<!DOCTYPE cib SYSTEM "crm-1.0.dtd">
<!-- no rsc class -->
<cib num_updates="1" epoch="1" admin_epoch="0">
  <configuration>
    <crm_config><cluster_property_set id="cib-bootstrap-options"><attributes>
      <nvpair id="no_quorum_policy" name="no_quorum_policy" value="ignore"/>
    </attributes></cluster_property_set></crm_config>
    <nodes>
      <node id="node1" uname="node1" type="member"/>
    </nodes>
    <resources>
      <primitive id="rsc1" type="apache"/>
    </resources>
    <constraints>
    </constraints>
  </configuration>
  <status>
    <node_state id="node1" ha="active" uname="node1" crmd="online" join="member" expected="member" in_ccm="true">
      <lrm id="any">
        <lrm_resources>
          <lrm_resource id="rsc1" class="heartbeat" type="apache"/>
        </lrm_resources>
      </lrm>
    </node_state>
  </status>
</cib>
